{
  "schemaVersion": 1,
  "status": "complete",
  "capabilities": ["static", "browser", "firebase-emulator", "database"],
  "browserSpec": "e2e/smoke.spec.ts",
  "requiredProof": {
    "primaryFlow": true,
    "failureOrEmptyPath": true,
    "phoneWidth": true,
    "cleanBrowserConsole": true
  }
}
